#,Wheelchairs,Price,Rating,Link,Top Review
1,Drive Medical Blue Streak Wheelchair with Flip Back   ...,$110.99 - $123.99,4.4/5.0,https://www.walmart.com/ip/Drive-Medical-Blue-Streak-Wheelchair-with-Flip-Back-Desk-Arms-Swing-Away-Footrests/15423509,blank
2,Drive Medical Lightweight Steel Transport Wheelchair  ...,$79.98 - $84.99,4.6/5.0,https://www.walmart.com/ip/Drive-Medical-Lightweight-Steel-Transport-Wheelchair-Fixed-Full-Arms/25514999,blank
3,Costway 24'' Lightweight Foldable Medical Wheelchair  ...,$125.99,3.0/5.0,https://www.walmart.com/ip/Costway-24-Lightweight-Foldable-Medical-Wheelchair-w-Footrest-FDA-Approved/984287550?wpa_bd=&wpa_pg_seller_id=E6EA4CDBA9CB4F54BB3775F6F818B84A&wpa_ref_id=8405a3fdc90dd328ea7d09dbaf2b7ede&wpa_aux_info=__aux_info__&wpa_tag=&wpa_pos=3&wpa_plmt=__plmt__&wpa_aduid=__aduid__,blank
4,Drive Medical Silver Sport 1 Wheelchair with Full Ar  ...,$117.04,4.5/5.0,https://www.walmart.com/ip/Drive-Medical-Silver-Sport-1-Wheelchair-with-Full-Arms-and-Swing-away-Removable-Footrest/15423452,blank
5,"Equate Transport Chair, Black",$135.00,4.7/5.0,https://www.walmart.com/ip/Equate-Transport-Chair-Black/14179126,blank
6,Drive Medical Blue Streak Wheelchair with Flip Back   ...,$123.06 - $129.79,4.2/5.0,https://www.walmart.com/ip/Drive-Medical-Blue-Streak-Wheelchair-with-Flip-Back-Desk-Arms-Elevating-Leg-Rests/28184367,blank
7,Medline Excel Deluxe Aluminum Transport Chair with H  ...,$119.99,4.3/5.0,https://www.walmart.com/ip/Medline-Excel-Deluxe-Aluminum-Transport-Chair-with-Hand-Brakes/23955882,blank
8,Drive Medical Cruiser III Light Weight Wheelchair wi  ...,$157.08 - $178.32,4.5/5.0,https://www.walmart.com/ip/Drive-Medical-Cruiser-III-Light-Weight-Wheelchair-with-Flip-Back-Removable-Desk-Arms-Elevating-Leg-Rests/15423515,blank
9,"Medline K1 Basic 18"" Wheelchair, Elevating Legrests,  ...",$135.69,4.8/5.0,https://www.walmart.com/ip/Medline-K1-Basic-18-Wheelchair-Elevating-Legrests-Full-Length-Arms/41051449,blank
10,Karman LT-1000HB Lightweight Transport Chair with Co  ...,$123.99,4.7/5.0,https://www.walmart.com/ip/Karman-LT-1000HB-Lightweight-Transport-Chair-with-Companion-Brakes-Burgundy/30347062,blank
11,"Drive Medical Silver Sport 2 Wheelchair, Detachable   ...",$154.02 - $192.49,4.5/5.0,https://www.walmart.com/ip/Drive-Medical-Silver-Sport-2-Wheelchair-Detachable-Desk-Arms-Elevating-Leg-Rests/15423464,blank
12,Medline K1 Basic Extra-Wide Wheelchair with Swing Aw  ...,$137.07,2.6/5.0,https://www.walmart.com/ip/Medline-K1-Basic-Extra-Wide-Wheelchair-with-Swing-Away-Footrests/41136886,blank
13,Drive Medical Cruiser III Light Weight Wheelchair wi  ...,$164.72 - $174.89,4.3/5.0,https://www.walmart.com/ip/Drive-Medical-Cruiser-III-Light-Weight-Wheelchair-with-Flip-Back-Removable-Full-Arms-Elevating-Leg-Rests/15423522,blank
14,Drive Medical Lightweight Expedition Transport Wheel  ...,$119.65 - $139.99,4.2/5.0,https://www.walmart.com/ip/Drive-Medical-Lightweight-Expedition-Transport-Wheelchair-with-Hand-Brakes/17284793,blank
15,Karman LT-700T Lightweight Wheelchair with Removable  ...,$148.41,4.3/5.0,https://www.walmart.com/ip/Karman-LT-700T-Lightweight-Wheelchair-with-Removable-Armrest-18-Seat-Silver-Vein/46906866,blank
16,"Medline K4 Basic Lightweight Wheelchair, 18 Wide Sea  ...",$194.93,3.3/5.0,https://www.walmart.com/ip/Medline-K4-Basic-Lightweight-Wheelchair-18-Wide-Seat-Desk-Length-Arms-Elevating-Leg-Rests/16641594,blank
17,"Drive Medical Chrome Sport Wheelchair, Detachable De  ...",$178.49 - $207.85,4.3/5.0,https://www.walmart.com/ip/Drive-Medical-Chrome-Sport-Wheelchair-Detachable-Desk-Arms-Elevating-Leg-Rests/15423494,blank
18,Drive Medical Lightweight Transport Wheelchair,$108.41 - $124.91,3.0/5.0,https://www.walmart.com/ip/Drive-Medical-Lightweight-Transport-Wheelchair/17284828,blank
19,"Medline K4 Basic 18"" Wheelchair, Elevating Legrests,  ...",$118.05,4.6/5.0,https://www.walmart.com/ip/Medline-K4-Basic-18-Wheelchair-Elevating-Legrests-Desk-Length-Arms/9894040,blank
20,Drive Medical Fly Lite Ultra Lightweight Transport W  ...,$130.19 - $149.99,4.7/5.0,https://www.walmart.com/ip/Drive-Medical-Fly-Lite-Ultra-Lightweight-Transport-Wheelchair/14563679,blank
21,Drive Medical Cruiser III Light Weight Wheelchair wi  ...,$145.43 - $169.49,4.6/5.0,https://www.walmart.com/ip/Drive-Medical-Cruiser-III-Light-Weight-Wheelchair-with-Flip-Back-Removable-Adjustable-Height-Desk-Arms-Swing-away-Footrests/15423521,blank
22,Carex Transport Wheelchair - 19 inch Seat - Folding   ...,$119.48,4.3/5.0,https://www.walmart.com/ip/Carex-Transport-Wheelchair-19-inch-Seat-Folding-Transport-Chair-with-Foot-Rests/33586234,blank
23,Drive Medical Deluxe Lightweight Aluminum Transport   ...,$109.99,4.8/5.0,https://www.walmart.com/ip/Drive-Medical-Deluxe-Lightweight-Aluminum-Transport-Wheelchair-Aluminum-Red/15423390,blank
24,"Drive Medical Sentra EC Heavy Duty Wheelchair, Detac  ...",$251.88 - $283.66,4.6/5.0,https://www.walmart.com/ip/Drive-Medical-Sentra-EC-Heavy-Duty-Wheelchair-Detachable-Desk-Arms-Elevating-Leg-Rests/15423476,blank
25,Drive Medical Duet Dual Function Transport Wheelchai  ...,$143.19 - $161.49,4.4/5.0,https://www.walmart.com/ip/Drive-Medical-Duet-Dual-Function-Transport-Wheelchair-Rollator-Rolling-Walker/15423364,blank
26,"Drive Medical Silver Sport 2 Wheelchair, Detachable   ...",$164.49 - $170.18,0.0/5.0,https://www.walmart.com/ip/Drive-Medical-Silver-Sport-2-Wheelchair-Detachable-Full-Arms-Swing-away-Footrests/40878917,blank
27,Drive Medical Trident HD Heavy Duty Power Wheelchair,"$2,599.00 - $2,699.00",3.0/5.0,https://www.walmart.com/ip/Drive-Medical-Trident-HD-Heavy-Duty-Power-Wheelchair/44389043,blank
28,Drive Medical Lightweight Black Transport Wheelchair,$117.82,4.6/5.0,https://www.walmart.com/ip/Drive-Medical-Lightweight-Black-Transport-Wheelchair/15423388,blank
29,Drive Medical Cruiser III Light Weight Wheelchair wi  ...,$168.00 - $188.98,4.3/5.0,https://www.walmart.com/ip/Drive-Medical-Cruiser-III-Light-Weight-Wheelchair-with-Flip-Back-Removable-Adjustable-Height-Desk-Arms-Elevating-Leg-Rests/15423526,blank
30,Drive Medical Viper Plus GT Wheelchair with Flip Bac  ...,$376.26 - $449.97,5.0/5.0,https://www.walmart.com/ip/Drive-Medical-Viper-Plus-GT-Wheelchair-with-Flip-Back-Removable-Adjustable-Full-Arms-Swing-away-Footrests/17284840,blank
31,"Medline Ultralight Transport Wheelchair with 19"" x 1  ...",$149.99,4.5/5.0,https://www.walmart.com/ip/Medline-Ultralight-Transport-Wheelchair-with-19-x-16-Seat-Red/30458181,blank
32,Drive Medical Nitro Euro Style Rollator Rolling Walk  ...,$226.56 - $254.73,4.6/5.0,https://www.walmart.com/ip/Drive-Medical-Nitro-Euro-Style-Rollator-Rolling-Walker/22356890,blank
33,"Medline K4 Extra-Wide Lightweight Wheelchair, 22"" Wi  ...",$284.48,0.0/5.0,https://www.walmart.com/ip/Medline-K4-Extra-Wide-Lightweight-Wheelchair-22-Wide-Seat-Removable-Desk-Length-Arms-Elevated-Leg-Rests/30497650,blank
34,Medline K1 Basic Extra-Wide Wheelchairs with Elevati  ...,$142.55,4.0/5.0,https://www.walmart.com/ip/Medline-K1-Basic-Extra-Wide-Wheelchairs-with-Elevating-Legrests/41494521,blank
35,Medline Excel K1 Standard Basic Wheel Chair,$131.48,4.1/5.0,https://www.walmart.com/ip/Medline-Excel-K1-Standard-Basic-Wheel-Chair/41133543,blank
36,Carex Wheelchair with Swing Away Footrests and Remov  ...,$148.88,3.5/5.0,https://www.walmart.com/ip/Carex-Wheelchair-with-Swing-Away-Footrests-and-Removable-Armrests/49409599,blank
37,Drive Medical Rebel Lightweight Wheelchair,$209.99,4.1/5.0,https://www.walmart.com/ip/Drive-Medical-Rebel-Lightweight-Wheelchair/21864724,blank
38,"Medline K4 Extra Wide 20"" Wheelchair, Swing Away Leg  ...",$174.63,4.6/5.0,https://www.walmart.com/ip/Medline-K4-Extra-Wide-20-Wheelchair-Swing-Away-Legs-Desk-Length-Arms/41068615,blank
39,"Karman LT-980 24 pounds Lightweight Wheelchair, 18""   ...",$333.96,4.0/5.0,https://www.walmart.com/ip/Karman-LT-980-24-pounds-Lightweight-Wheelchair-18-seat-Burgundy/35494745,blank
40,Drive Medical Bariatric Heavy Duty Transport Wheelch  ...,$169.99 - $182.55,4.6/5.0,https://www.walmart.com/ip/Drive-Medical-Bariatric-Heavy-Duty-Transport-Wheelchair-with-Swing-Away-Footrest/15061023,blank
