#,Patient Care,Price,Rating,Link,Top Review
1,"ReliOn Nitrile Examination Gloves, 100 Ct",$9.24,4.4/5.0,https://www.walmart.com/ip/ReliOn-Nitrile-Examination-Gloves-100-Ct/14284765,blank
2,Curad Basic Care Large/Extra Large Vinyl Exam Gloves  ...,$7.73,4.3/5.0,https://www.walmart.com/ip/Curad-Basic-Care-Large-Extra-Large-Vinyl-Exam-Gloves-100-count/44621723,blank
3,"Urinary Drainage Bag, Urine Drain Bag, Anti-Reflux V  ...",$5.89,0.0/5.0,https://www.walmart.com/ip/Urinary-Drainage-Bag-Urine-Drain-Bag-Anti-Reflux-Valve-2000-ml-Vinyl-37-2802-Each/161868542,blank
4,"Equate Latex Examination Gloves, One Size, 50 Ct",$5.96,0.0/5.0,https://www.walmart.com/ip/Equate-Latex-Examination-Gloves-One-Size-50-Ct/300343224,blank
5,Safeskin Purple Nitrile Powder-Free Exam Disposable   ...,$13.19 - $14.22,4.3/5.0,https://www.walmart.com/ip/Safeskin-Purple-Nitrile-Powder-Free-Exam-Disposable-Gloves-Large/10715978,blank
6,Sitz Bath Carex® Round Dusty Rose Polypropylene,$15.08,4.5/5.0,https://www.walmart.com/ip/Sitz-Bath-Carex-Round-Dusty-Rose-Polypropylene/27931344,blank
7,"3M Littmann Classic III Stethoscope, Available in Mu  ...",$80.78 - $92.99,3.7/5.0,https://www.walmart.com/ip/3M-Littmann-Classic-III-Stethoscope-Available-in-Multiple-Colors/170590406,blank
8,"3M Littmann Lightweight II S.E. Stethoscope, Availab  ...",$45.00 - $62.15,3.2/5.0,https://www.walmart.com/ip/3M-Littmann-Lightweight-II-S-E-Stethoscope-Available-in-Multiple-Colors/21720622,blank
9,"3M Littmann Cardiology IV Stethoscope, Available in   ...",$165.10 - $191.38,2.7/5.0,https://www.walmart.com/ip/3M-Littmann-Cardiology-IV-Stethoscope-Available-in-Multiple-Colors/112383005,blank
10,Navage Nasal Irrigation Deluxe Bundle: Navage Nose C  ...,$116.95 - $119.95,4.0/5.0,https://www.walmart.com/ip/Navage-Nasal-Irrigation-Deluxe-Bundle-Navage-Nose-Cleaner-48-SaltPod-Capsules-Countertop-Caddy-Travel-Case-162-75-purchased-separately-You-save-52-80/157182505,blank
11,"Equate Vinyl Examination Gloves, 100 Ct",$7.98,0.0/5.0,https://www.walmart.com/ip/Equate-Vinyl-Examination-Gloves-100-Ct/709075118,blank
12,Nature Made® Super B-Complex Dietary Supplement Tabl  ...,$15.444.0¢/each,5.0/5.0,https://www.walmart.com/ip/Nature-Made-Super-B-Complex-Dietary-Supplement-Tablets-390ct/634283052,blank
13,"Equate Earloop Mask Disposable Mask, 20 Ct",$2.97,5.0/5.0,https://www.walmart.com/ip/Equate-Earloop-Mask-Disposable-Mask-20-Ct/745929347,blank
14,"3M Littmann Classic II S.E. Adult Stethoscope, Black",$64.28,4.5/5.0,https://www.walmart.com/ip/3M-Littmann-Classic-II-S-E-Adult-Stethoscope-Black/14930019,blank
15,"Cervical Neck Traction Device, Inflatable Neck Tract  ...",$17.95,5.0/5.0,https://www.walmart.com/ip/Cervical-Neck-Traction-Device-Inflatable-Neck-Traction-Neck-Brace-for-Fast-Neck-Head-Shoulder-Pain-Relief-Adjustable-and-FDA-Approved/136497820,blank
16,"Equate Gauze Pads, 3""x3"", 25 Ct",$3.54,5.0/5.0,https://www.walmart.com/ip/Equate-Gauze-Pads-3-x3-25-Ct/344776932,blank
17,ChoiceMMed Pulse Oximeter,$34.99,4.6/5.0,https://www.walmart.com/ip/ChoiceMMed-Pulse-Oximeter/17325061,blank
18,"BD Ultra-Fine Pen Needles Nano, Penta Point Comfort,  ...",$25.95,5.0/5.0,https://www.walmart.com/ip/BD-Ultra-Fine-Pen-Needles-Nano-Penta-Point-Comfort-4mm-x-32G-90-Count/118727719,blank
19,Kimberly-Clark PROFESSIONAL Protective Gear Disposab  ...,$11.88 - $20.41,4.5/5.0,https://www.walmart.com/ip/Kimberly-Clark-PROFESSIONAL-Protective-Gear-Disposable-Purple-Nitrile-Exam-Gloves-Small-100-Count-KCC-55081/22582311,blank
20,Cara Hot Water Bottle Personal Hygiene And Enema Sys  ...,$14.46,4.2/5.0,https://www.walmart.com/ip/Cara-Hot-Water-Bottle-Personal-Hygiene-And-Enema-System-2-Quart-Combination/10320773,blank
21,"Equate Headache Relief, Acetaminophen, Aspirin & Caf  ...",$4.00,5.0/5.0,https://www.walmart.com/ip/Equate-Headache-Relief-Acetaminophen-Aspirin-Caffeine-Extra-Strength-Twin-Pack-200-Caplets/350249376,blank
22,Nauzene Nausea Relief Chewable Tablets Wild Cherry F  ...,$4.96,5.0/5.0,https://www.walmart.com/ip/Nauzene-Nausea-Relief-Chewable-Tablets-Wild-Cherry-Flavor-42-CT/932026162,blank
23,"Equate Vinyl Examination Gloves, One Size, 50 Ct",$5.84,0.0/5.0,https://www.walmart.com/ip/Equate-Vinyl-Examination-Gloves-One-Size-50-Ct/265514745,blank
24,"Medline Powder-Free Synthetic Vinyl Exam Gloves, Med  ...",$53.004.0¢/each,4.5/5.0,https://www.walmart.com/ip/Medline-Powder-Free-Synthetic-Vinyl-Exam-Gloves-Medium-Case-of-1500/23955876,blank
25,"Hyland's Leg Cramps, Quick Disolving Tablets 50 Ct",$4.14,4.0/5.0,https://www.walmart.com/ip/Hyland-s-Leg-Cramps-Quick-Disolving-Tablets-50-Ct/26967331,blank
26,ProSource Acupressure Mat and Pillow Set for Back/Ne  ...,$19.99,0.0/5.0,https://www.walmart.com/ip/ProSource-Acupressure-Mat-and-Pillow-Set-for-Back-Neck-Pain-Relief-and-Muscle-Relaxation/50997715,blank
27,CPAP H2O Premium Distilled Water - 10 Bottle Pack,$21.99,0.0/5.0,https://www.walmart.com/ip/CPAP-H2O-Premium-Distilled-Water-10-Bottle-Pack/676534792,blank
28,As Seen On Tv Lo Bak Trax Back Stretcher - Dual Trac  ...,$29.88,3.8/5.0,https://www.walmart.com/ip/As-Seen-On-Tv-Lo-Bak-Trax-Back-Stretcher-Dual-Traction-Force-Spinal-Traction-Device/983625450,blank
29,"SCRUBSTAR Women's Fashion Collection ""Polar Penguins  ...",$15.96,0.0/5.0,https://www.walmart.com/ip/SCRUBSTAR-Women-s-Fashion-Collection-Polar-Penguins-Printed-Scrub-Top/435139868,blank
30,"Herbal Perineal Spray - Naturally Soothing, Safe for  ...",$11.15$2.79/oz,5.0/5.0,https://www.walmart.com/ip/Herbal-Perineal-Spray-Naturally-Soothing-Safe-for-Pregnancy-and-Postpartum-4-Fl-Oz/26961041,blank
31,Primacare ST-6856 CPR Mask,$5.51,0.0/5.0,https://www.walmart.com/ip/Primacare-ST-6856-CPR-Mask/55381439,blank
32,"Prism Series Aluminum Single Head Nurse Stethoscope,  ...",$5.35,3.7/5.0,https://www.walmart.com/ip/Prism-Series-Aluminum-Single-Head-Nurse-Stethoscope-Magenta-Boxed/31261949,blank
33,"Prism Series Aluminum Dual Head Stethoscope, Teal, B  ...",$7.00,3.2/5.0,https://www.walmart.com/ip/Prism-Series-Aluminum-Dual-Head-Stethoscope-Teal-Boxed/31261928,blank
34,MDF Acoustica Dual Head Stethoscope,$24.99,0.0/5.0,https://www.walmart.com/ip/MDF-Acoustica-Dual-Head-Stethoscope/169211069,blank
35,Ambimed Easy and Comfortable Diabetic Injection Aid,$27.99,5.0/5.0,https://www.walmart.com/ip/Ambimed-Easy-and-Comfortable-Diabetic-Injection-Aid/590785169,blank
36,Mabis Signature Series Stainless Steel Dual Head Ste  ...,$27.10,5.0/5.0,https://www.walmart.com/ip/Mabis-Signature-Series-Stainless-Steel-Dual-Head-Stethoscope-Adult-Black/22589235,blank
37,Primacare RS-6845 CPR Mask in Red Hard Plastic Carry  ...,$6.59,0.0/5.0,https://www.walmart.com/ip/Primacare-RS-6845-CPR-Mask-in-Red-Hard-Plastic-Carrying-Case/49156009,blank
38,MDF Dual Head Stethoscope,$13.51 - $14.99,0.0/5.0,https://www.walmart.com/ip/MDF-Dual-Head-Stethoscope/161067850,blank
39,BalanceFrom Acupressure Yoga Mat and Pillow Set for   ...,$17.99,5.0/5.0,https://www.walmart.com/ip/BalanceFrom-Acupressure-Yoga-Mat-and-Pillow-Set-for-Back-and-Neck-Pain-Relief-and-Muscle-Relaxation-Massage/922106404,blank
40,Cervical Neck Traction Device for Head & Shoulder Re  ...,$15.99,4.4/5.0,https://www.walmart.com/ip/Cervical-Neck-Traction-Device-for-Head-Shoulder-Relief-Brown/592691468,blank
