#,Walking Canes,Price,Rating,Link,Top Review
1,"Carex Offset Quad Cane Small Base, Black",$12.50,4.2/5.0,https://www.walmart.com/ip/Carex-Offset-Quad-Cane-Small-Base-Black/14255235,blank
2,Carex Black Adjustable Offset Walking Cane,$11.15,4.5/5.0,https://www.walmart.com/ip/Carex-Black-Adjustable-Offset-Walking-Cane/9894417,blank
3,Yescom Portable Folding Walking Stick Seat Travel Ca  ...,$20.95 - $21.95,0.0/5.0,https://www.walmart.com/ip/Yescom-Portable-Folding-Walking-Stick-Seat-Travel-Cane-Adjustable-Height-Tripod-Hiking-Chair-Aluminium-Color-Opt/777761023?wpa_bd=&wpa_pg_seller_id=F746B1E5AC54495DBD321A325A96265E&wpa_ref_id=f00d17aa87f4b9b40fb8a37f1080ca7f&wpa_aux_info=__aux_info__&wpa_tag=&wpa_pos=3&wpa_plmt=__plmt__&wpa_aduid=__aduid__,blank
4,LivingPro All Terrain LED Folding Walking Cane- 6 Ul  ...,$20.95,5.0/5.0,https://www.walmart.com/ip/LivingPro-All-Terrain-LED-Folding-Walking-Cane-6-Ultra-Bright-Built-In-LEDs-Folds-in-Seconds-5-Adjustable-Height-Levels/689463532,blank
5,"Carex Offset Adjustable Designer Walking Cane, Blue",$12.99,4.3/5.0,https://www.walmart.com/ip/Carex-Offset-Adjustable-Designer-Walking-Cane-Blue/9894415,blank
6,Medline Quad Cane Small Base Black,$11.95,4.3/5.0,https://www.walmart.com/ip/Medline-Quad-Cane-Small-Base-Black/9894033,blank
7,Lightweight Tripod Cane Tip Self standing Non-slip r  ...,$5.99,0.0/5.0,https://www.walmart.com/ip/Lightweight-Tripod-Cane-Tip-Self-standing-Non-slip-replacement-Walking-Stick-Quadruple-for-Cane/472368888,blank
8,"Equate Quad Cane Small Base, Black",$15.74,5.0/5.0,https://www.walmart.com/ip/Equate-Quad-Cane-Small-Base-Black/14179116,blank
9,"Medline Bariatric Quad Cane, 500lbs Capacity",$20.34,4.8/5.0,https://www.walmart.com/ip/Medline-Bariatric-Quad-Cane-500lbs-Capacity/7983644,blank
10,Hickory Walking Stick,$16.94,0.0/5.0,https://www.walmart.com/ip/Hickory-Walking-Stick/36363722,blank
11,"Hugo QuadPod Offset Cane with Ultra Stable Cane Tip,  ...",$26.95,4.6/5.0,https://www.walmart.com/ip/Hugo-QuadPod-Offset-Cane-with-Ultra-Stable-Cane-Tip-Aquamarine/17753865,blank
12,"Carex Round Handle Walking Cane, 7/8"", Natural",$11.84,5.0/5.0,https://www.walmart.com/ip/Carex-Round-Handle-Walking-Cane-7-8-Natural/28932811,blank
13,"Equate Comfort Grip Cane, Black",$13.74,3.5/5.0,https://www.walmart.com/ip/Equate-Comfort-Grip-Cane-Black/14179114,blank
14,Hugo Adjustable Quad Cane for Right or Left Hand Use  ...,$26.95,5.0/5.0,https://www.walmart.com/ip/Hugo-Adjustable-Quad-Cane-for-Right-or-Left-Hand-Use-Rose-Large-Base/15120048,blank
15,Carex Derby Designer U.S. Flag Walking Cane,$15.99,4.8/5.0,https://www.walmart.com/ip/Carex-Derby-Designer-U-S-Flag-Walking-Cane/17215623,blank
16,HurryCane HurryCane Freedom Edition Folding Cane wit  ...,$32.54 - $39.95,4.1/5.0,https://www.walmart.com/ip/HurryCane-HurryCane-Freedom-Edition-Folding-Cane-with-T-Handle/54055466,blank
17,"Equate Folding Cane, Black",$18.74,5.0/5.0,https://www.walmart.com/ip/Equate-Folding-Cane-Black/14179136,blank
18,"PCP Wood Cane With Round Handle, Mahogany, Large Gri  ...",$11.99 - $22.99,0.0/5.0,https://www.walmart.com/ip/PCP-Wood-Cane-With-Round-Handle-Mahogany-Large-Grip/908507350,blank
19,4 Feet Stand-Up Cane - Hurry Before They Are Gone -   ...,$29.77,5.0/5.0,https://www.walmart.com/ip/4-Feet-Stand-Up-Cane-Hurry-Before-They-Are-Gone-Adjustable-Foldable-With-LED-Light/534871024,blank
20,Travel Walking Cane Take Apart Folding Foldable Fold  ...,$14.08,4.0/5.0,https://www.walmart.com/ip/Travel-Walking-Cane-Take-Apart-Folding-Foldable-Fold-Up-Stick-Adjustable-Handle/156231078,blank
21,Folding Multi-Angle Cane,$24.99,5.0/5.0,https://www.walmart.com/ip/Folding-Multi-Angle-Cane/197963769,blank
22,"Carex Small Base Designer Quad Cane, Blue Satin",$19.35,4.5/5.0,https://www.walmart.com/ip/Carex-Small-Base-Designer-Quad-Cane-Blue-Satin/10716134,blank
23,"Equate Self Standing Cane Tip, 7/8"" to 3/4""",$8.74,0.0/5.0,https://www.walmart.com/ip/Equate-Self-Standing-Cane-Tip-7-8-to-3-4/14179112,blank
24,Super Big Foot Cane Tip in Black,$11.06,5.0/5.0,https://www.walmart.com/ip/Super-Big-Foot-Cane-Tip-in-Black/54423195,blank
25,Carex Small Base Offset Quad Cane,$38.30,0.0/5.0,https://www.walmart.com/ip/Carex-Small-Base-Offset-Quad-Cane/28932772,blank
26,Hand Carved Design Wood Walking Hiking Hike Stick Ca  ...,$19.29,0.0/5.0,https://www.walmart.com/ip/Hand-Carved-Design-Wood-Walking-Hiking-Hike-Stick-Cane-Staff-55-Length-55-By-USA/886849322,blank
27,Topeakmart Walking Stick Aluminium Folding Adjustabl  ...,$8.39,4.7/5.0,https://www.walmart.com/ip/Topeakmart-Walking-Stick-Aluminium-Folding-Adjustable-Light-Weight-Support-Aid-Cane-Red/529029360,blank
28,"Demi Folding Cane, Wildflower",$25.93 - $27.90,5.0/5.0,https://www.walmart.com/ip/Demi-Folding-Cane-Wildflower/35318101,blank
29,"PCP Replacement Walker or Commode Tips, Black, 1-inc  ...",$4.99,0.0/5.0,https://www.walmart.com/ip/PCP-Replacement-Walker-or-Commode-Tips-Black-1-inch-Diameter/820759485,blank
30,"Carex Designer Soft Grip Derby Walking Cane, Blue",$15.03,4.5/5.0,https://www.walmart.com/ip/Carex-Designer-Soft-Grip-Derby-Walking-Cane-Blue/13447045,blank
31,"Carex Ergo Offset Handle Walking Cane, Purple",$15.68,5.0/5.0,https://www.walmart.com/ip/Carex-Ergo-Offset-Handle-Walking-Cane-Purple/30414383,blank
32,"Gentle Touch Offset Folding Cane, Danube Blue",$23.90,0.0/5.0,https://www.walmart.com/ip/Gentle-Touch-Offset-Folding-Cane-Danube-Blue/35316028,blank
33,"Carex Round Handle Walking Cane, Silver Mens",$15.75,5.0/5.0,https://www.walmart.com/ip/Carex-Round-Handle-Walking-Cane-Silver-Mens/33455783,blank
34,"Hugo QuadPod Offset Cane with Ultra Stable Cane Tip,  ...",$26.95,4.2/5.0,https://www.walmart.com/ip/Hugo-QuadPod-Offset-Cane-with-Ultra-Stable-Cane-Tip-Ebony/17753854,blank
35,"PCP Replacement Walker Tips (Pair), Grey, 1.25 Inch   ...",$4.99,0.0/5.0,https://www.walmart.com/ip/PCP-Replacement-Walker-Tips-Pair-Grey-1-25-Inch-Diameter/188574096,blank
36,Drive Medical Folding Lightweight Cane with Sling St  ...,$21.29,4.2/5.0,https://www.walmart.com/ip/Drive-Medical-Folding-Lightweight-Cane-with-Sling-Style-Seat/17351525,blank
37,DuraCare Premium Adjustable Folding Black Cane - Adj  ...,$9.57,3.0/5.0,https://www.walmart.com/ip/DuraCare-Premium-Adjustable-Folding-Black-Cane-Adjusts-from-33-37-inches/165899993,blank
38,Folding Collapsible Travel Hiking Walking Stick with  ...,$18.20 - $19.01,5.0/5.0,https://www.walmart.com/ip/Folding-Collapsible-Travel-Hiking-Walking-Stick-with-LED-Light-Cushion-Handle-Adjustable-Folding-Cane-for-Men-and-Women/904429195,blank
39,"PCP Folding Cane, Fritz Handle Grip, Lightweight Adj  ...",$18.99 - $19.99,0.0/5.0,https://www.walmart.com/ip/PCP-Folding-Cane-Fritz-Handle-Grip-Lightweight-Adjustable-Aluminum-Shaft-Compass-Rose-Pattern/911082051,blank
40,Hugo Adjustable Derby Handle Cane with Reflective St  ...,$16.21,5.0/5.0,https://www.walmart.com/ip/Hugo-Adjustable-Derby-Handle-Cane-with-Reflective-Strap-Smoke/17772621,blank
