#,Walkers & Rollators,Price,Rating,Link,Top Review
1,Drive Medical Four Wheel Rollator Rolling Walker wit  ...,$55.58 - $57.19,4.7/5.0,https://www.walmart.com/ip/Drive-Medical-Four-Wheel-Rollator-Rolling-Walker-with-Fold-Up-Removable-Back-Support/28647754,blank
2,Drive Medical Deluxe Two Button Folding Walker with   ...,$28.39,4.7/5.0,https://www.walmart.com/ip/Drive-Medical-Deluxe-Two-Button-Folding-Walker-with-5-Wheels/40877930,blank
3,"Medline Steel Foldable Rollator Walker with 6"" Wheel  ...",$53.94,4.1/5.0,https://www.walmart.com/ip/Medline-Steel-Foldable-Rollator-Walker-with-6-Wheels-Green/40825479,blank
4,Carex Steel Rollator Walker with Seat and Backrest,$45.49,3.8/5.0,https://www.walmart.com/ip/Carex-Steel-Rollator-Walker-with-Seat-and-Backrest/48676819,blank
5,Drive Medical Adjustable Height Rollator Rolling Wal  ...,$69.99 - $77.08,4.5/5.0,https://www.walmart.com/ip/Drive-Medical-Adjustable-Height-Rollator-Rolling-Walker-with-6-Wheels/17284823,blank
6,"Equate Rolling Walker, Black",$89.00,4.6/5.0,https://www.walmart.com/ip/Equate-Rolling-Walker-Black/14179110,blank
7,"Medline Steel Rollator Walker, Burgundy, 350 lbs Cap  ...",$54.99,4.5/5.0,https://www.walmart.com/ip/Medline-Steel-Rollator-Walker-Burgundy-350-lbs-Capacity/37617768,blank
8,"Medline Steel Foldable Rollator Walker with 8"" Wheel  ...",$73.35,5.0/5.0,https://www.walmart.com/ip/Medline-Steel-Foldable-Rollator-Walker-with-8-Wheels-Red/40824169,blank
9,Medline Extra Wide Heavy Duty Rollator Walker,$109.99,4.7/5.0,https://www.walmart.com/ip/Medline-Extra-Wide-Heavy-Duty-Rollator-Walker/44608046,blank
10,"Equate Folding Walker with Wheels, Black",$49.67,4.8/5.0,https://www.walmart.com/ip/Equate-Folding-Walker-with-Wheels-Black/14179124,blank
11,"Medline Ultra Lightweight Rollator, Burgundy",$99.00,4.3/5.0,https://www.walmart.com/ip/Medline-Ultra-Lightweight-Rollator-Burgundy/7983648,blank
12,"Medline Steel Foldable Rollator Walker with 8"" Wheel  ...",$60.54,3.5/5.0,https://www.walmart.com/ip/Medline-Steel-Foldable-Rollator-Walker-with-8-Wheels-Blue/40874795,blank
13,"Medline Empower Rollator, Blue",$129.00,4.6/5.0,https://www.walmart.com/ip/Medline-Empower-Rollator-Blue/45582397,blank
14,Carex Step 'N Rest Rolling Rollator Walker with Padd  ...,$86.10,4.6/5.0,https://www.walmart.com/ip/Carex-Step-N-Rest-Rolling-Rollator-Walker-with-Padded-Seat-and-Backrest/14668627,blank
15,"Drive Medical Steel Rollator Rolling Walker with 8""   ...",$98.45,4.5/5.0,https://www.walmart.com/ip/Drive-Medical-Steel-Rollator-Rolling-Walker-with-8-Wheels/55151829,blank
16,Equate Steerable Knee Walker Scooter,$115.00,4.6/5.0,https://www.walmart.com/ip/Equate-Steerable-Knee-Walker-Scooter/128305573,blank
17,"Drive Medical Rollator Rolling Walker with 6"" Wheels",$65.99 - $68.49,5.0/5.0,https://www.walmart.com/ip/Drive-Medical-Rollator-Rolling-Walker-with-6-Wheels/40878879,blank
18,Dual Release Folding Walker Universal drive™ Aluminu  ...,$30.60,4.2/5.0,https://www.walmart.com/ip/Dual-Release-Folding-Walker-Universal-drive-Aluminum-Frame-300-lbs-Weight-Capacity-28-3-4-to-38-1-2-Inch-Height/15423433,blank
19,Walker Dual Button Release 300 Lb Adult  1/CS,$31.92,4.3/5.0,https://www.walmart.com/ip/Walker-Dual-Button-Release-300-Lb-Adult-1-CS/12518961,blank
20,Drive Medical Trigger Release Folding Walker,$39.30,4.7/5.0,https://www.walmart.com/ip/Drive-Medical-Trigger-Release-Folding-Walker/10740649,blank
21,"Medline Combination Rollator/Transport Wheelchair, B  ...",$179.69,4.4/5.0,https://www.walmart.com/ip/Medline-Combination-Rollator-Transport-Wheelchair-Blue/13248453,blank
22,Drive Medical Two Wheeled Walker with Seat,$38.40 - $39.55,3.9/5.0,https://www.walmart.com/ip/Drive-Medical-Two-Wheeled-Walker-with-Seat/43224556,blank
23,Drive Medical Breast Cancer Awareness Adjustable Hei  ...,$76.90,4.9/5.0,https://www.walmart.com/ip/Drive-Medical-Breast-Cancer-Awareness-Adjustable-Height-Rollator-Rolling-Walker-Pink/32807356,blank
24,Basic Steel Rollators - MDS86850ES,$62.60,4.4/5.0,https://www.walmart.com/ip/Basic-Steel-Rollators-MDS86850ES/40884694,blank
25,"Karman R-4700 Heavy Duty Bariatric Rollator with 8""   ...",$107.69,5.0/5.0,https://www.walmart.com/ip/Karman-R-4700-Heavy-Duty-Bariatric-Rollator-with-8-Wheels-Padded-Seat-and-Backrest-Wire-Basket-Loop-Brakes-Blue/30296547,blank
26,Medline Deluxe Aluminum Foldable Rollator Walker wit  ...,$102.51,5.0/5.0,https://www.walmart.com/ip/Medline-Deluxe-Aluminum-Foldable-Rollator-Walker-with-8-Wheels-Blue/54736332,blank
27,Drive Medical Winnie Lite Supreme 3 Wheel Rollator W  ...,$72.99,4.4/5.0,https://www.walmart.com/ip/Drive-Medical-Winnie-Lite-Supreme-3-Wheel-Rollator-Walker/15423369,blank
28,Drive Medical Clever Lite LS Rollator Walker with Se  ...,$77.58,3.7/5.0,https://www.walmart.com/ip/Drive-Medical-Clever-Lite-LS-Rollator-Walker-with-Seat-and-Push-Down-Brakes/15423373,blank
29,Medline Deluxe Aluminum Foldable Rollator Walker wit  ...,$102.51,5.0/5.0,https://www.walmart.com/ip/Medline-Deluxe-Aluminum-Foldable-Rollator-Walker-with-8-Wheels-Rose/54736330,blank
30,"HealthSmart Gateway Aluminum Rollator, Titanium, 31""  ...",$82.98,4.5/5.0,https://www.walmart.com/ip/HealthSmart-Gateway-Aluminum-Rollator-Titanium-31-36-H-300-lb-Capacity/21382710,blank
31,Drive Medical Nitro Euro Style Rollator Rolling Walk  ...,$214.95 - $259.95,4.6/5.0,https://www.walmart.com/ip/Drive-Medical-Nitro-Euro-Style-Rollator-Rolling-Walker/22356890,blank
32,Drive Medical 3 Wheel Rollator Rolling Walker with B  ...,$84.92 - $85.48,4.3/5.0,https://www.walmart.com/ip/Drive-Medical-3-Wheel-Rollator-Rolling-Walker-with-Basket-Tray-and-Pouch/17284830,blank
33,"Hugo Portable Rollator Rolling Walker with Seat, Bac  ...",$102.57,4.6/5.0,https://www.walmart.com/ip/Hugo-Portable-Rollator-Rolling-Walker-with-Seat-Backrest-and-8-Wheels-Blue/17772614,blank
34,Carex Trio 3 Wheel Rolling Walker Rollator,$70.25,4.0/5.0,https://www.walmart.com/ip/Carex-Trio-3-Wheel-Rolling-Walker-Rollator/17215626,blank
35,Drive Medical Duet Dual Function Transport Wheelchai  ...,$143.19 - $173.50,4.4/5.0,https://www.walmart.com/ip/Drive-Medical-Duet-Dual-Function-Transport-Wheelchair-Rollator-Rolling-Walker/15423364,blank
36,Drive Medical DV8 Aluminum Steerable Knee Walker Kne  ...,$146.99,4.6/5.0,https://www.walmart.com/ip/Drive-Medical-DV8-Aluminum-Steerable-Knee-Walker-Knee-Scooter-Crutch-Alternative/15423445,blank
37,Medline Platform Walker Attachment,$33.88,4.3/5.0,https://www.walmart.com/ip/Medline-Platform-Walker-Attachment/7983663,blank
38,"Medline Steel Foldable Rollator Walker with 6"" Wheel  ...",$62.47,4.3/5.0,https://www.walmart.com/ip/Medline-Steel-Foldable-Rollator-Walker-with-6-Wheels-Blue/40824304,blank
39,"Medline Empower Multipurpose Deluxe Rollator Walker,  ...",$144.67,4.5/5.0,https://www.walmart.com/ip/Medline-Empower-Multipurpose-Deluxe-Rollator-Walker-Black/45582396,blank
40,Drive Medical Aluminum Rollator Rolling Walker with   ...,$71.39,4.7/5.0,https://www.walmart.com/ip/Drive-Medical-Aluminum-Rollator-Rolling-Walker-with-Fold-Up-and-Removable-Back-Support-and-Padded-Seat/15423380,blank
